{
	"$schema": "https://abtree.sh/schemas/tree.schema.json",
	"name": "abtree_implement",
	"version": "3.0.0",
	"tree": {
		"type": "sequence",
		"name": "Implementation_Workflow",
		"children": [
			{
				"type": "action",
				"name": "Score_Complexity",
				"steps": [
					{
						"evaluate": "$LOCAL.plan is set"
					},
					{
						"instruct": "Read $LOCAL.plan. Assign a complexity score from 0.0 (trivial, single-file edit) to 1.0 (cross-cutting architectural change) and store it at $LOCAL.complexity_score."
					}
				]
			},
			{
				"type": "selector",
				"name": "Architectural_Review",
				"children": [
					{
						"type": "action",
						"name": "Escalate_To_Opus",
						"steps": [
							{
								"evaluate": "$LOCAL.complexity_score is greater than $GLOBAL.complexity_threshold"
							},
							{
								"instruct": "Complexity is above $GLOBAL.complexity_threshold. Delegate $LOCAL.plan to an opus-class architect agent for review. Capture its verdict and any required revisions, then store the consolidated feedback at $LOCAL.architect_review."
							}
						]
					},
					{
						"type": "action",
						"name": "Skip_Opus",
						"steps": [
							{
								"instruct": "Complexity is below the escalation threshold. Store \"skipped\" at $LOCAL.architect_review."
							}
						]
					}
				]
			},
			{
				"type": "sequence",
				"name": "Apply_Plan",
				"children": [
					{
						"type": "action",
						"name": "Ensure_Plan_And_Review_Are_Set",
						"steps": [
							{
								"evaluate": "$LOCAL.plan is set and $LOCAL.architect_review is set"
							}
						]
					},
					{
						"type": "action",
						"name": "Implement",
						"steps": [
							{
								"instruct": "Read $GLOBAL.clean_code_guide and follow it while implementing $LOCAL.plan, incorporating $LOCAL.architect_review where it is not \"skipped\". Apply the rules to every file you write, and treat the guide's \"Done means\" and \"When to stop and ask\" sections as part of this step's success criteria."
							},
							{
								"evaluate": "\n\t\t\t\tRun the project tests and ensure all pass with sufficient coverage.\n\t\t\t"
							},
							{
								"evaluate": "Run the project linters and ensure all pass."
							}
						],
						"retries": 5
					}
				]
			}
		]
	},
	"description": "Implement an approved plan with complexity-gated architectural review, following the clean-code rules in clean-code.md.",
	"state": {
		"local": {
			"plan": null,
			"complexity_score": null,
			"architect_review": null
		},
		"global": {
			"clean_code_guide": "load clean-code.md",
			"complexity_threshold": 0.75
		}
	}
}
