{
	"$schema": "https://abtree.sh/schemas/tree.schema.json",
	"name": "abtree-regression",
	"version": "0.0.0",
	"tree": {
		"type": "sequence",
		"name": "Regression_Suite",
		"children": [
			{
				"type": "sequence",
				"name": "Local_State_Round_Trip",
				"children": [
					{
						"type": "action",
						"name": "Write_Counter",
						"steps": [
							{
								"instruct": "Write the integer 1 to $LOCAL.counter and submit success."
							}
						]
					},
					{
						"type": "action",
						"name": "Verify_Counter",
						"steps": [
							{
								"evaluate": "$LOCAL.counter is 1"
							}
						]
					},
					{
						"type": "action",
						"name": "Write_Greeting",
						"steps": [
							{
								"instruct": "Write the literal string \"hello\" to $LOCAL.greeting and submit success."
							}
						]
					},
					{
						"type": "action",
						"name": "Verify_Greeting",
						"steps": [
							{
								"evaluate": "$LOCAL.greeting is \"hello\""
							}
						]
					}
				]
			},
			{
				"type": "selector",
				"name": "Selector_Fall_Through",
				"children": [
					{
						"type": "action",
						"name": "Always_Fail",
						"steps": [
							{
								"evaluate": "$LOCAL.counter is 999"
							}
						]
					},
					{
						"type": "action",
						"name": "Recovery",
						"steps": [
							{
								"instruct": "Write the integer 2 to $LOCAL.counter and submit success."
							}
						]
					}
				]
			},
			{
				"type": "action",
				"name": "Verify_Recovery",
				"steps": [
					{
						"evaluate": "$LOCAL.counter is 2"
					}
				]
			},
			{
				"type": "action",
				"name": "Verify_Global_Default",
				"steps": [
					{
						"evaluate": "$GLOBAL.expected_status is \"ok\""
					}
				]
			},
			{
				"type": "sequence",
				"name": "Delegate_Round_Trip",
				"children": [
					{
						"type": "action",
						"name": "Spawn_Delegate_Round_Trip",
						"steps": [
							{
								"instruct": "Delegate the next stretch of the tree to a subagent. Exit token: DLG__Delegate_Round_Trip__a94a036b. Failure token: DLG__Delegate_Round_Trip__a94a036b__FAILED. ORDERING — submit success for THIS step BEFORE spawning the subagent, because the runtime advances the cursor only on submit. Otherwise the subagent's first `abtree next` would return this same instruct. Use model: \"haiku\". If your harness does not support model selection, ignore this hint. BRIEF: Write the literal string \"ok\" to the delegate output slot. Driver-only walk — no subagent is actually spawned. Procedure: (1) Call `abtree submit <execution> success` for this step now. (2) Spawn a subagent with this brief: drive `abtree next/eval/submit` on this execution. For evaluates, read every referenced $LOCAL/$GLOBAL path from the store before calling `abtree eval`. When you process an instruct named `Return_To_Parent_Delegate_Round_Trip`, follow its text: submit success for that step, then return ONLY the literal token `DLG__Delegate_Round_Trip__a94a036b` to your parent and do not call `abtree next` again. If `abtree next` ever returns `{status:\"done\"}` or `{status:\"failure\"}`, return ONLY the literal token `DLG__Delegate_Round_Trip__a94a036b__FAILED`. (3) Block on the subagent. (4) Verify the returned reply equals exactly `DLG__Delegate_Round_Trip__a94a036b`. Any other reply (including `DLG__Delegate_Round_Trip__a94a036b__FAILED` or extra text) means the scope failed — surface that and stop driving. (5) On successful verification, call `abtree next` to receive the next post-scope action."
							}
						]
					},
					{
						"type": "action",
						"name": "Inner_Work",
						"steps": [
							{
								"instruct": "Write the literal string \"ok\" to $LOCAL.delegate_output and submit success."
							}
						]
					},
					{
						"type": "action",
						"name": "Return_To_Parent_Delegate_Round_Trip",
						"steps": [
							{
								"evaluate": "$LOCAL.delegate_output is set"
							},
							{
								"instruct": "Subagent exit point for scope `Delegate_Round_Trip`. Submit success for this step, then return ONLY the literal token `DLG__Delegate_Round_Trip__a94a036b` to your parent. Do not call `abtree next` again — the parent will resume from here."
							}
						]
					}
				]
			}
		]
	},
	"state": {
		"local": {
			"counter": null,
			"greeting": null,
			"delegate_output": null
		},
		"global": {
			"expected_status": "ok"
		}
	}
}
