{
	"$schema": "https://abtree.sh/schemas/tree.schema.json",
	"name": "@abtree/technical-writer",
	"version": "0.1.0",
	"tree": {
		"type": "sequence",
		"name": "Technical_Writer_Workflow",
		"children": [
			{
				"type": "selector",
				"name": "Resolve_Styleguide",
				"children": [
					{
						"type": "action",
						"name": "Load_Styleguide",
						"steps": [
							{
								"evaluate": "$LOCAL.goal is set and STYLEGUIDE.md exists at $GLOBAL.repo_root"
							},
							{
								"instruct": "Read STYLEGUIDE.md from $GLOBAL.repo_root and store its contents at $LOCAL.styleguide."
							}
						]
					},
					{
						"type": "sequence",
						"name": "Bootstrap_Styleguide",
						"children": [
							{
								"type": "action",
								"name": "Draft_Styleguide",
								"steps": [
									{
										"evaluate": "$LOCAL.goal is set"
									},
									{
										"instruct": "No STYLEGUIDE.md exists at $GLOBAL.repo_root. Draft a minimal one covering: voice (first vs second person), tone, sentence case, code-fence conventions, link style, file and heading naming, and any project-specific rules you can infer from existing docs. Store the draft at $LOCAL.styleguide. Do NOT write to disk yet."
									}
								]
							},
							{
								"type": "action",
								"name": "Human_Approval_Gate",
								"steps": [
									{
										"evaluate": "$LOCAL.styleguide is set"
									},
									{
										"instruct": "Present the draft styleguide at $LOCAL.styleguide to the human. Wait for them to confirm by calling `abtree local write <flow-id> styleguide_approved true`. While waiting, you may submit `running`. Do NOT submit success until they confirm. If they reject, submit failure. The workflow will terminate — the human will then author STYLEGUIDE.md themselves and re-run; the next run takes the Load_Styleguide branch and skips the bootstrap entirely."
									},
									{
										"evaluate": "$LOCAL.styleguide_approved is true"
									},
									{
										"instruct": "Write $LOCAL.styleguide to STYLEGUIDE.md at $GLOBAL.repo_root."
									}
								]
							}
						]
					}
				]
			},
			{
				"type": "action",
				"name": "Assess_Intent",
				"steps": [
					{
						"evaluate": "$LOCAL.styleguide is set"
					},
					{
						"instruct": "Analyse $LOCAL.goal. Determine: - Type: tutorial, reference, conceptual explainer, how-to. - Scope: one section, one page, multiple pages. - Audience: new user, integrator, contributor, internal. Store the analysis at $LOCAL.intent."
					}
				]
			},
			{
				"type": "selector",
				"name": "Survey_Existing_Docs",
				"children": [
					{
						"type": "action",
						"name": "Map_Placement",
						"steps": [
							{
								"evaluate": "$LOCAL.intent is set and a home for this content already exists in the docs tree"
							},
							{
								"instruct": "Walk the docs tree. Find the right path or parent section for $LOCAL.intent. List the adjacent pages and identify where in the sidebar / nav this should slot. Store the placement plan at $LOCAL.docs_survey and the chosen target file path at $LOCAL.placement."
							}
						]
					},
					{
						"type": "action",
						"name": "Resolve_Structure",
						"steps": [
							{
								"evaluate": "$LOCAL.intent is set"
							},
							{
								"instruct": "No home exists for $LOCAL.intent. Decide on a structural change — a new section, a new page, a new sidebar entry, or a refactor of an existing section. Implement the structural change first (create the directory, update the sidebar config, etc.) and only then proceed. Store the placement plan at $LOCAL.docs_survey and the chosen target file path at $LOCAL.placement."
							}
						]
					}
				]
			},
			{
				"type": "sequence",
				"name": "Write_And_Review",
				"children": [
					{
						"type": "action",
						"name": "Write_Documentation",
						"steps": [
							{
								"evaluate": "$LOCAL.intent is set and $LOCAL.docs_survey is set and $LOCAL.placement is set"
							},
							{
								"instruct": "Write or revise the documentation at $LOCAL.placement. If $LOCAL.review_notes is set and not \"approved\", treat it as the prior reviewer's specific feedback and address every point. Otherwise this is a fresh write. Adhere to $LOCAL.styleguide. Match the voice and structure described in $LOCAL.docs_survey. Address $LOCAL.intent precisely — type, scope, audience. Save the file. Store the written text at $LOCAL.draft."
							}
						]
					},
					{
						"type": "action",
						"name": "Review_Gate",
						"steps": [
							{
								"evaluate": "$LOCAL.draft is set"
							},
							{
								"instruct": "Run three checks against $LOCAL.draft: (1) Structure — does it fit the placement and adjacency described in $LOCAL.docs_survey? (2) Flow — does the narrative read end-to-end without gaps or duplication? (3) Atomicity — does it address ONE concept, not multiple bundled together? If all three pass, set $LOCAL.review_notes to \"approved\". If any fails, write specific notes to $LOCAL.review_notes naming the failed check and the concrete issue."
							},
							{
								"evaluate": "$LOCAL.review_notes is \"approved\""
							},
							{
								"instruct": "All three checks passed. Confirm the file at $LOCAL.placement and store its path at $LOCAL.final_path."
							}
						]
					}
				],
				"retries": 2
			}
		]
	},
	"description": "Take a documentation goal, ground it in the repo's styleguide, find or build a home in the docs tree, write to it, and gate-check structure / flow / atomicity. Up to three write/review passes (one initial + two retries) before surfacing failure to the human.",
	"state": {
		"local": {
			"goal": null,
			"styleguide": null,
			"styleguide_approved": null,
			"intent": null,
			"docs_survey": null,
			"placement": null,
			"draft": null,
			"review_notes": null,
			"final_path": null
		},
		"global": {
			"repo_root": "the cwd of the project being documented"
		}
	}
}
